Text,Constraint
"I'm all for a zero-cost experience, but I'd weigh the pros of paying if it drastically cuts down on time or frustration.",1
"I do see the value in supporting content creators, so I'd pay a modest sum if it helps keep the platform updated and robust.",1
"If paying a bit fosters a more interactive or dynamic environment, I'd do it, but I'd still prefer a free base with optional extras.",1
"I wouldn't mind a flexible subscription that I can cancel anytime if it doesn't meet my needs, so I'm soft on that approach.",1
"Though I'd like it free, I'd pay a minimal monthly if there's guaranteed direct Q&A with experts or priority support.",1
"As long as the price isn't exorbitant, I'd consider paying, but I'd also look for a free alternative if it's similarly good.",1
"I'm not strictly 'free only,' but I'd keep the cost as low as possible unless I'm convinced of the premium's big advantages.",1
"I might be open to a donation-based model, paying what I can if it doesn't force a set fee, so that's flexible for me.",1
"If there's a discount for students, I'd pay that reduced rate, otherwise I'd strongly push for a no-cost or cheaper alternative.",1
"Free is simpler, though I'd be ready to invest a bit if there's a recognized accreditation or official qualification that comes with it.",1
"A small monthly cost is tolerable, but I'd want the ability to pause or cancel anytime, so I'm not locked in long-term.",1
"I'm definitely leaning free, but I'd buy a premium add-on once or twice if it drastically enhances my performance or results.",1
"If there's a paywall for advanced modules, I'd see how vital they are. I'd pay if they're crucial, or skip them if not absolutely needed.",1
"Though I'd strongly prefer free, I'd do a micro-transaction approach if each purchase is modest and specifically beneficial to me.",1
"A free trial is my top pick, but I'd continue paying if I truly enjoy the platform and see consistent updates and support.",1
"While I'd look for free first, I'm not opposed to paying if that means I'm supporting a well-maintained, professional resource.",1
"I might pay a small registration fee if it's a recognized brand, but I'd prefer to confirm there's no hidden charges afterward.",1
"No cost is best, but I'd do partial cost if it unlocks personal tutoring sessions or grading by experts, so I'd see that as a plus.",1
"I won't entirely discount a cost-based approach, but I'd need a guarantee that the higher-tier content is truly advanced.",1
"I don't mind a tip jar or optional donation to support the creators, but I'd like the core material to remain free if possible.",1
"While I'd choose free if it meets my needs, I'd add a paid extension for specialized labs or deeper modules if it's fairly priced.",1
"If there's an expensive plan, I'd skip it, but I'd do a cheaper or basic plan if the difference in content is minimal.",1
"I prefer not to pay monthly, so I'd opt for a small one-time fee if that means indefinite access to updates or expansions.",1
"Although I'd rely on free content, I'd pay for a certificate if it's recognized by professional bodies or helps my resume.",1
"Low-cost is my limit, but I'd do that if the standard of teaching is proven, as I'd see the investment as worthwhile.",1
"Even though I'd like not to pay monthly, I'd consider a heavily discounted annual plan if it offers a lower rate overall.",1
"I'm comfortable with a modest license fee if it's a well-established brand, but I'd remain cautious about hidden or recurring charges.",1
"I see free as a starting point, but I'd add extra funds if there's real mentorship or personal project feedback in a premium tier.",1
"Though I prioritize cost savings, I'd pay a small sum if it's beneficial for my career growth or includes official endorsements.",1
"A pay-per-course model might be acceptable if each one is affordable enough, rather than a high all-access pass.",1
"I won't dismiss the idea of paying, but I'd watch for sales, coupons, or special offers to keep the expense reasonable.",1
"While no cost is better for me, I'd invest if it speeds up my progress significantly, thus saving me time in the long run.",1
"I prefer a free approach, but I'd sign up for a nominal monthly if it drastically improves features like personalized feedback.",1
"A zero-fee method is simpler, though I'd weigh a small cost if the learning environment is far more engaging or structured.",1
"While I'd rather avoid charges, I'd endure them if the service includes dedicated tutors or a real-time Q&A forum.",1
"If there's a feasible pay-what-you-can system, I'd contribute something small, but I'd want that to remain optional.",1
"I'd strongly lean to free, but I'd spend a limited amount if advanced certification or recognized credentials are part of the package.",1
A minimal monthly or quarterly plan wouldn't bother me if there's enough fresh content introduced regularly to justify it.,1
"I don't want to pay a fortune, but I'd handle a modest bill if it ensures everything is up-to-date and run by quality instructors.",1
"Though I'd keep an eye on my wallet, I'd definitely pay for specialized resources that free sites typically don't offer.",1
"If a portion is free and the rest paid, I'd try the free portion first, then consider paying if it meets my expectations.",1
I'm open to partial payments if there's a proven track record of success for those who've used the resource in a paid capacity.,1
"Though I'd want no cost, I'd pay if there's official accreditation that can be recognized in job applications.",1
"I prefer that all the basics are free, but I'd do a micropayment for advanced labs or certain expert-led sessions.",1
"While I typically won't pay for general knowledge, I'd invest if it specifically addresses niche or specialized topics I'm after.",1
"I have a tight budget, but I'd scrounge up a small sum if the resource is unbelievably effective for skill-building.",1
"Though free is simpler, I'd chip in for maintenance if the platform is user-friendly and actively improving.",1
"I'd rather not pay a subscription, but I'd do a one-time purchase if it unlocks everything permanently.",1
"I'm drawn to free plans, yet I'd appreciate a premium approach if it drastically shortens my learning curve or includes advanced quizzes.",1
"If there's a special discount for early sign-ups, I'd pay that, but otherwise I'd keep looking for free alternatives.",1
"While I'd love everything to cost nothing, I'd pay if it includes direct teacher feedback or personal progress reports.",1
I won't mind paying a little for advanced software integrations or add-ons that expedite my workflow significantly.,1
"If there's a voucher or scholarship method, I'd be more inclined to pay a portion, as it wouldn't be full price.",1
"Though I'm partial to free solutions, I'd budge if the cost is minimal and the platform is known for high-quality content.",1
"I prefer not to overspend, but I'd do so if it means I can skip ads or skip sponsor segments that slow me down.",1
"My approach is to find a free service, but I'd upgrade to a paid plan if the difference in content is truly game-changing.",1
"While I'd keep an eye on hidden fees, I'd pay if the cost is transparent and each feature is clearly worth it.",1
"I'd be okay with a small premium if there's a money-back guarantee, ensuring I won't waste funds if it's not for me.",1
"Though I'd prefer zero cost, I'd do a micro-subscription if there's a community aspect that free alternatives don't offer.",1
"I typically want a free solution, but I'd pay up to a modest threshold if there's an official diploma or recognition at the end.",1
"If the cost isn't too high, I'd consider it, but I'd hate to be locked into a high monthly payment for minimal upgrades.",1
"A partial donation-based model is appealing, as I'd pay what I find fair while still being able to keep costs low if needed.",1
"I'm slightly flexible on budget, so I'd do a paid approach if it's guaranteed to be better than rummaging around free YouTube videos.",1
"While I'd like to keep my money, I'd spend a small monthly fee for a structured curriculum and progress tracking.",1
"I won't dismiss paying, but I'd likely compare the cost to known free resources to ensure it's definitely worth it.",1
"I prefer a free core and optional paid extras, so I'd just buy those extras if they genuinely address my personal learning gaps.",1
I'd be fine with paying a small sum if it includes practice tests or official exam prep that free resources can't replicate.,1
"Though I'd love free, I'd invest a token amount if that includes direct teacher feedback on assignments, so it's somewhat flexible.",1
"I have absolutely no budget, so it must be entirely free or I can't proceed in any capacity.",2
"I cannot pay anything at all, meaning a zero-cost solution is my only option.",2
"There's no possibility of paying for this, so it must remain 100% free from start to finish.",2
"Unless it's free, I cannot continue, because I have no funds to allocate to a paid subscription.",2
"If there's any mandatory fee, I'm out, as my current financial situation doesn't allow any spending.",2
"I need a resource that's entirely no-cost, or I'm forced to abandon the plan altogether.",2
"My finances won't permit even a small payment, so free access is a strict requirement.",2
I'm constrained to a zero-dollar approach; any premium cost excludes me from participating.,2
"It's critical there's no charge at all, because I simply have no way to afford paid materials.",2
"I must not spend a dime, so a paywall or subscription model is a complete deal-breaker.",2
"I'm stuck with no budget, so there's no chance I'd pay for advanced features or any other tier.",2
"Free is absolutely mandatory; if there's a single payment needed, I'm unable to proceed.",2
"I have zero wiggle room for fees, making a free platform the only viable solution for my situation.",2
"If there's a charge for the main content, I'd be immediately disqualified, since I can't allocate funds.",2
"A no-cost structure is non-negotiable, as I cannot justify any expense in my current circumstances.",2
"I cannot afford even a small monthly fee, so free access to all features is required.",2
"Any form of payment, whether one-time or recurring, is impossible for me, so free is the only path.",2
"I'm reliant on it being free, or I'd have to give up on the idea altogether.",2
"Paying is simply not an option, so I'd only enroll if the entire resource remains costless.",2
"I'm totally restricted from paying, thus the resource must come at no cost to me whatsoever.",2
"Financial constraints mean a free platform is the only route, ruling out any paid plans.",2
"If there's no free version, I'm unable to join, as I cannot spend anything beyond zero dollars.",2
"I refuse to pay any subscription or purchase fee, so it must be free or I'm not participating.",2
"My budget is nonexistent, so a paywall of any kind disqualifies the resource for me.",2
"Unless every feature is included at no charge, I'm forced to seek a different free alternative.",2
I can't handle partial or hidden costs; it must be clearly and completely free from the get-go.,2
"Zero cost is mandatory across all modules, with no pay upgrades, or I'll drop the course immediately.",2
"I lack the means to pay, so a strictly free model is the only approach that allows me to continue.",2
"I won't sign up if there's even a minor fee, because my budget is absolutely zero.",2
A free setup is crucial; even a minimal cost won't be feasible given my current financial state.,2
"I can't proceed if there's a membership fee, so only a cost-free offering works for me.",2
"No cost is acceptable except free, so there's no discussion about monthly or one-time payments.",2
I'm restricted to a resource that doesn't require a credit card or any form of payment to access the core lessons.,2
"If it's not free, I'm out immediately, as I can't justify any extra expense right now.",2
I only accept a zero-cost plan; optional paid extras won't help if the main content is locked behind a paywall.,2
"The entire course, from start to finish, must be free of charge, or I'm unable to partake at all.",2
"I won't be able to pay for even minor upgrades, so everything has to be part of a no-cost plan by default.",2
Only a free solution is viable; I'm not open to negotiations about small fees or partial payments.,2
"My situation demands that there is absolutely no payment required, or I can't use the platform.",2
"All content must be free with no strings attached, or I'd be forced to find another no-cost resource.",2
"Paying for this is not an option, so a fully free structure is my only path forward.",2
It must remain free permanently; a trial that transitions into a paid model won't be acceptable for me.,2
"I absolutely refuse to enter any credit card details, so I'd only join if it's perpetually free.",2
"I do not have the means to handle fees, so a mandatory payment is a hard stop for me.",2
"Free or bust: if there's even a talk of monthly billing, it's impossible for me to continue.",2
"I can't do a donation-based approach either, as I have zero funds; it must be free with no requests for payment.",2
"There's no scenario where I'd pay for learning content, so if there's no free route, I'm out.",2
No budget whatsoever means I'd need a costless environment—no subscription and no hidden fees.,2
"I require full, unlimited access for free, or I'd be cut off once a pay gate appears.",2
"No cost from day one is critical, or I'd never make it to day two with a paid program I can't afford.",2
"If advanced lessons cost money, I'd be immediately excluded, since I can't do partial content without missing essential topics.",2
"I'm in a situation where I can't pay, so all premium or advanced content must also be free if it's vital to learning.",2
"We require the entire module to be no cost, or I'd be stuck half-finished if it transitions to paid halfway.",2
"I can't proceed if there's a single moment when I'm asked for payment info, so free must apply to all features equally.",2
"Since I'm unemployed currently, a strict zero-fee model is the only feasible approach for me.",2
"I require a purely free solution, with no possibility of future charges or expansions that cost money.",2
"A paywall at any level is a non-starter, so I'm only able to use a platform with every feature unlocked at no cost.",2
"Free is not just a preference but an absolute must, so there's no chance I'd engage with a pay-to-progress system.",2
"I cannot sign up for a subscription, even if it's cheap, so that rules out any partially paid services.",2
"All modules must be zero cost, or I'd end up missing major content that I can't pay to unlock.",2
"If there's a single purchase requirement, I'm forced to back out, as my budget is null.",2
"I won't accept a scenario where I'm free initially, then forced to pay for the final certification, so it must be free entirely.",2
"I'd be locked out if it isn't entirely free, because I can't pay a cent for online courses at the moment.",2
"Not one dollar can be spent on this, so free is the only condition that works given my constraints.",2
"Every aspect of the resource must come without cost, or I can't complete the full learning path.",2
"I can't accept the presence of microtransactions or paywalled features, as I won't be able to unlock them.",2
"If it requests payment info at any point, I'm done, because it's outside my means to commit financially.",2
"There's no room in my finances for even minimal fees, so I'd require a fully sponsored or costless approach.",2
"I won't proceed with partial free content if the essential modules require payment, so it must be 100% free.",2
An entirely free structure is the only model that doesn't exclude me right now.,2
"I can't proceed unless the final exam or certification is also free, otherwise I'd never finalize the course.",2
"I'm stuck if there's a pay-to-unlock progression, so that can't exist if I'm to finish the entire curriculum.",2
"As there's no line item in my budget for online learning, zero cost is the only feasible scenario for me.",2
"I wouldn't be able to continue if there's a mandatory 'donation' or minimal payment, so it truly must be free.",2
"No interest in partial pay solutions, because I can't manage even small sums at the moment.",2
"I'm restricted from making online payments entirely, so the course must remain free of monetary transactions.",2
"I can't handle a scenario where the main content is locked behind a monthly membership, so I'd pass if it's not fully free.",2
"Free must cover everything from notes to quizzes to final certification, or I'd be at a dead end for finishing it.",2
"I won't do a trial that auto-converts to paid, so truly free with no forced upgrade is mandatory.",2
"There's zero chance I'll sign up if they ask for a card on file, so I need a direct, cost-free sign-up method.",2
"A mandatory fee is entirely off the table, so I'll only use it if there's no point at which I must pay.",2
"I don't have any disposable income, so purely free is the only path that aligns with my resources.",2
"Any arrangement that eventually charges me isn't feasible, so it must remain free with no time-limited premium transitions.",2
"I can't afford to pay for advanced track modules, so all tracks must be included at no cost for my usage.",2
"No financial outlay is possible for me, so I'd immediately discard any sign of a paid premium tier that blocks key learning materials.",2
"I'm absolutely reliant on free resources, so I'd skip this if there's a pay barrier for essential features.",2
"There's no negotiation possible: I won't pay a penny, so the entire program must be funded by some other means.",2
I require an unconditional free license or I'm simply not able to start or keep up with the lessons financially.,2
"Even ad-supported is fine, but I can't directly pay, so if there's a cost to remove ads, I'd have to remain on the free tier anyway.",2
"I won't accept locked modules or pay-to-unlock expansions, so all content must be accessible from the free tier.",2
"I'm in a position where free is mandatory, so a paid add-on wouldn't help me if the main content is incomplete in free mode.",2
"No cost at all is feasible, otherwise I'd drop out before even beginning, given my financial limitations.",2
"If a cost is introduced at advanced levels, I'd never reach them, so there's no point if it's not fully free from start to finish.",2
"I can't justify an expense, so if the course isn't entirely free, I'd be forced to look elsewhere immediately.",2
"No money can exchange hands in my case, so the platform must survive without user fees for me to use it fully.",2
"I won't consider solutions that only have a free trial, because I'd eventually have to pay, which is impossible.",2
"There's no scenario where I'd pay for optional or mandatory features, so the resource has to supply all at no cost.",2
"I need a direct free sign-up that doesn't ask for billing info, or I'd fail to pass that step with my zero budget.",2
"I'm strictly looking for an always-free plan, as I can't transition to a paid plan after a limited period or usage cap.",2
"If advanced quizzes or certifications require payment, I'd be locked out, so the entire path must be freely accessible.",2
"A lumpsum or recurring fee is equally impossible, so there's no difference if it's cheap or expensive—free is the only route.",2
"My financial situation forbids me from paying for apps or courses, so I'd rely on it being free or not use it at all.",2
"I can't engage with microtransactions, as even small amounts add up to something I can't afford, so 100% free is required.",2
"A pay-what-you-want approach is still out for me, because I can't contribute anything, so truly free is needed.",2
"I can't do a donation-based system either, because I won't be able to donate, so the resource must let me in for free.",2
"If there's a forced upgrade to continue advanced lessons, I'd never get that advanced knowledge, so it's a no-go for me.",2
"I won't submit any payment credentials, so that blocks all pay systems unless it's free with no card info required.",2
"Any fee, even if small, is out of the question, so I'd only engage if zero cost is guaranteed across the board.",2
"Without free certification at the end, I'd have no reason to do the course, because I can't pay for official credentials.",2
"I need everything from reading materials to final assessment at no charge, or I'd end up incomplete in the program.",2
"A financed or sponsored approach must be in place, because I'm not paying anything personally out of pocket.",2
"If there's a special discount, it's still irrelevant to me, because my budget is literally zero—free is essential.",2
"I'm strictly searching for resources that are free for all functionalities, as partial free won't serve my needs entirely.",2
"There's no route for me to handle fees, so I'd require fully unlocked features at no monetary requirement.",2
"I have no method to transfer money or pay online, so if the platform tries to charge me, I'd be forced to quit.",2
"A paid model is effectively blocking me from learning, so I won't consider it unless it's switched to zero cost.",2
"I cannot do a pay-later scheme, as I'd eventually owe money that I can't provide, so it must be absolutely free from day one.",2
"I'm restricted from using any paid services by personal circumstances, so free is the only solution that works.",2
"If there's any subscription tier gating essential modules, I'd be excluded, so the entire curriculum must be free.",2
"I cannot handle the overhead of a monthly cost, so I'd rely on a platform that doesn't charge at all.",2
"Given my economic constraints, I'd instantly drop out if asked for payment at any stage, so it must be no-cost forever.",2
"I'm forced to pick only free solutions, so I'd skip this entirely if there's a pay step needed for advanced content.",2
"No pay-based tiers are acceptable, as I'd be restricted to the free tier if it doesn't hold all the necessary tools.",2
"I can't do microtransactions for specialized lessons or modules, so everything must be part of the free package from the start.",2
"Without a wholly free approach, I'd never pass the advanced sections, so I'd just never enroll in the first place.",2
"A forced donation or tip-based system is effectively a payment, which I'm unable to provide, making it a no-go for me.",2
"Even if the cost is small, it's out of my reach, so a free approach is the only method I'd commit to.",2
"I'm on a grant that doesn't allow personal expenses, so I'd have to forego any paid content altogether.",2
"If there's no guaranteed free route for the entire curriculum, I'd be wasting my time starting it, as I'd eventually get stuck.",2
"Given my zero budget, I'd only consider entirely costless solutions, or I'd remain uneducated in that domain.",2
"I require full accessibility to all resources at no price, or I'd never be able to complete the final tasks or exams.",2
"A paygate means I'd effectively be locked out, so that can't exist if I'm to fully participate in the program.",2
"I'm not allowed to make online transactions, so the platform must not require them, meaning free from top to bottom.",2
"Any monthly plan or even a single purchase option is impossible for me, thus free is mandatory in this scenario.",2
"It's crucial that there's zero cost for everything, or I'd invest my time in a resource that I can fully utilize for free.",2
"I won't pay for optional advanced modules, so they must be included in the free plan if they're essential to the curriculum.",2
"No financial barrier can exist, as I'd fail to bypass it at any step, so a cost-free approach is the only solution.",2
"I refuse to do any transaction or deposit, so there can be no partial pay blocks for me to continue using the platform.",2
"A fully zero-cost model is absolutely non-negotiable, or I'd be forced to discontinue immediately due to lack of funds.",2
I typically prefer engaging videos but can adapt to reading-based lessons if it makes sense for the topic.,1
"Although I like small practice exercises, I'd be okay with purely theoretical modules if they're well-explained.",1
"I enjoy hands-on tasks, but if they're not readily available, I'm still fine exploring the concepts through lectures.",1
"I learn well when there's a mix of auditory content and text; however, I'm flexible if we only have one or the other.",1
"My usual style involves interactive labs, yet I'll manage with detailed explanations if labs aren't the main focus.",1
"I favor visual aids like infographics or slide decks, though I'd be fine with mostly text-based content in a pinch.",1
"I do well in group discussions, but if it's a solo course with a forum, I can adapt to that environment too.",1
"I love interactive quizzes, yet I'd still get by if the course uses standard reading assignments alone.",1
"I prefer real-time Q&A sessions, though I'm not opposed to asynchronous messaging if that's the chosen format.",1
"I'm partial to examples and case studies, but I'd be okay if there's more abstract theory than real-life examples sometimes.",1
"I like a blend of short videos and written instructions, but if I must choose, I'm flexible to rely on only one mode.",1
"Generally, I'm more engaged with instructor-led sessions, but I'd adapt to self-paced modules if they're well structured.",1
"I prefer having plenty of practice questions, yet I'll cope if the material focuses on thorough readings and minimal exercises.",1
"A variety of formats keeps me interested, but I'd be fine with a single consistent format if it's high quality.",1
"I usually respond best to synchronous lessons, but I'll manage if everything is delivered asynchronously.",1
"I'm a big fan of group projects, although if the course is self-contained, I'll still learn effectively on my own.",1
