Text,Constraint
"The absolute maximum I can handle is 5 minutes thrice a week, so if the course demands daily presence, I'm out.",2
"I have no freedom for unscheduled expansions, so a lesson cannot exceed 15 minutes once we've committed to that format.",2
My daily limit is precisely 3 minutes for all learning tasks; going beyond that is impossible for me right now.,2
"I require that each lesson run under 10 minutes, every day, or I'd break the consistent schedule I'm forced to follow.",2
"I must do exactly one 15-minute session on Fridays, no additional time during the week is feasible at all.",2
"I absolutely cannot sit for lessons longer than 5 minutes, so that is an unwavering boundary for me.",2
"If there's a session requiring more than 10 minutes in one go, I'd drop out, because I can't make that kind of time available.",2
"I am only able to commit to 20 minutes total per month, so if that doesn't cover everything, I won't proceed.",2
"I must finalize each day's work in under 5 minutes, or I'd skip it entirely, which means I'd fail the course structure.",2
"Any single module crossing 15 minutes is out of reach, as my schedule won't let me handle extended blocks at all.",2
"Everything must be completed within a 10-minute limit each day, or I'd miss out and fall behind for sure.",2
"I can't accommodate changes; if it's more than 5 minutes at a time, I'd have to forfeit the entire plan.",2
"I only have availability for 15 minutes once a week, so the course can't push more sessions on other days.",2
"I cannot do multiple short sessions; it must be precisely one 5-minute window every other day, or I'm done.",2
"If the final project demands hours of work, I'd have to quit, because there's no chance I can allocate that time.",2
"I'm restricted to no more than 10 minutes total weekly, so it must be micro lessons strictly curated around that limit.",2
I won't look at anything that requires daily attendance beyond 2 minutes; my entire schedule is too rigid to allow more.,2
"Any instructions that suggest a continuous half-hour session won't work for me, so it's mandatory to keep them way shorter.",2
I'm at my limit with 5 minutes of study once a day; there's no option to extend or do multiple sessions in one day.,2
"If the material is delivered in a 20-minute block, I'm done, because I'd never find that block in my normal routine.",2
"My personal constraints require all lessons to be under 10 minutes, with no single session surpassing that limit.",2
"I can't handle even an occasional 30-minute requirement, so if it appears, I'd be forced to discontinue immediately.",2
"My daily routine only opens a 3-minute slot for new lessons; anything else won't fit, so there's no flexibility there.",2
"I must be able to complete the entire course in less than 15 minutes per week, or it's not going to be achievable for me.",2
"I'm strictly unavailable on weekends, so if there's a large block placed then, I'd have to abandon the program altogether.",2
"I can only do one quick 5-minute check-in each day, so if it goes beyond that, I'll fail to keep up with the flow.",2
"I can't merge multiple small lessons into a bigger chunk, so each must remain individually under 5 minutes or I won't do them.",2
"I need to confirm everything is taught in micro lessons under 10 minutes total a day, or I'd never open the modules at all.",2
"I'm not in a position to rearrange for a 1-hour workshop, so the course has to revolve around micro-sessions under 15 minutes each.",2
"I have no tolerance for any session that runs 20 minutes straight, so I'd drop if it's not broken down into smaller parts.",2
"I require extremely short daily modules, as any request to do a 30-minute or longer session means I'd leave the course.",2
"Multiple tasks summing over 10 minutes a day won't work, so it needs to be a single, minimal session, or I'm out.",2
"Without daily 5-minute content, I'd be forced to skip days and fail, so it must conform strictly to that format.",2
"I do not have the capacity for 2-hour monthly sessions or anything that lumps content heavily, so it's a non-starter for me.",2
"If the lessons require I watch 15-minute videos in one sitting, I'm finished, because I can't block that time at all.",2
"I must allocate no more than 5 minutes to each topic, so if a topic demands 6 or 7 minutes, I'd never finish it fully.",2
"It's essential that no single learning unit surpasses 10 minutes total; otherwise, I'd fail to keep pace with daily tasks.",2
"I'm not able to rearrange or skip around content, so if there's a large mandatory block, I'd have to give up right away.",2
"I can only do micro-labs of 2 minutes each; bigger labs aren't feasible in my line of work, so I'd be forced out if they're necessary.",2
Time constraints won't let me read or watch anything over 5 minutes; I'd exit the program if a module is longer than that.,2
"I'm obliged to daily duties, so I'd fail if the course needs a single session beyond 10 minutes at once.",2
"I must keep every study instance to 3 minutes or below, or I'd be missing essential chores and won't keep up the course at all.",2
"If there's a summary that takes more than 5 minutes, I'd skip it, effectively losing track, so it has to remain super short.",2
"I can't meet a schedule that lumps lessons into weekly 1-hour classes, so I'd be out if that's the default format.",2
"It must align with a 5-minute daily routine or I'm done, because I can't shift other responsibilities around at all.",2
"I'm restricted to an extremely strict timeline; if the course doesn't break down into tiny portions under 10 minutes, I won't manage it.",2
I require an absolute max of 15 minutes for the entire week; there's no flexibility for extra sessions or expansions.,2
"I generally prefer a moderately thorough explanation, but I'm fine if we occasionally go either deeper or shallower when it makes sense.",1
"I like an overview that isn't too shallow, yet I'm okay if we take a deeper dive into complex topics now and then.",1
"I don't need a fully advanced breakdown of every tiny detail; however, I'd welcome extra depth if it's relevant.",1
"I'm comfortable with a blend of high-level summaries and occasional deep explorations, so I'm flexible in that regard.",1
"I prefer somewhat detailed explanations, though I'd handle more superficial coverage in certain chapters if needed.",1
"I enjoy going beyond the basics, but I won't be upset if certain sections remain a bit shallow for brevity's sake.",1
"A nice mix of moderate detail with some advanced tangents here and there works well for me, but I'm not strict about it.",1
"While I lean towards in-depth coverage, I'd be fine if some lessons stay at a simpler level for time efficiency.",1
"I appreciate a fairly thorough approach, but I'd adapt if we keep specific sections at a high-level summary.",1
"I'm happy if we mostly cover intermediate depth, though I'd still follow if we occasionally skim or go really deep.",1
"I like it when topics aren't just surface-level, yet I'm flexible if a few areas remain more basic.",1
"I typically want a bit more than an overview, but I'd be okay with a less rigorous explanation for simpler concepts.",1
"I prefer diving into details, though I'd accept if only the major points are highlighted in some segments.",1
"I enjoy moderate depth throughout, but I'd handle a simpler summary if it's sufficient for certain modules.",1
"Although I like advanced insights, I'd manage if the course only goes into deeper theory intermittently.",1
"A balanced approach between thorough and concise is my preference, so I'm not upset if we keep it mostly moderate.",1
"I definitely like some complexity, but I'm flexible about not diving too deep into every single subtopic.",1
"I'm good with a medium-level dive, and I'd be open to either more advanced or more superficial expansions when relevant.",1
"I don't require exhaustive detail across the board, yet I'd appreciate a bit of depth for crucial concepts.",1
"I prefer a somewhat deep approach, but it's not a big deal if we occasionally skip advanced specifics.",1
"Though I like fairly comprehensive coverage, I'd be fine if certain sections only scratch the surface for brevity.",1
"I'm cool with fairly detailed coverage, but I'd adapt if some lessons stay lightweight due to time constraints.",1
"I prefer leaning toward a deep dive, but I won't complain if parts remain fairly high-level for convenience.",1
"Moderate detail is ideal, yet I'd be alright shifting deeper or shallower depending on what's most efficient.",1
"I'm a fan of thorough analysis, but I'd accept if we only get a minimal explanation in some areas.",1
"While I'd love robust detail, it's okay if only the main points are emphasized for simpler sections.",1
"I prefer at least mid-level depth, but I'm fine if the occasional lesson stays closer to an overview.",1
"I enjoy exploring nuances, though I'd cope if some modules remain quite basic to save time.",1
"I'm open to a decent analysis, yet I'd accept if certain chapters are just outlines without extensive elaboration.",1
"I like to see the bigger picture thoroughly, but I'd handle some parts being more succinct or skipping the nitty-gritty.",1
"I enjoy dissecting topics, but it's not a deal-breaker if we keep a portion of the course at an entry-level viewpoint.",1
"I would appreciate in-depth coverage, though I'm not rigid if the format leans a bit more general in places.",1
"I'm partial to going deeper, yet I'd be flexible if we keep certain lessons more straightforward for clarity.",1
"I typically enjoy deeper knowledge, but I'd manage if we remain at an intermediate scope to cater to everyone.",1
"I wouldn't mind advanced coverage, though I'd accept if the course doesn't push far beyond the fundamentals in all topics.",1
"I like thorough dives, but I'm okay if the course occasionally glosses over advanced details that aren't critical.",1
"I'm comfortable exploring complexities, but I'd be open to a simpler approach in some cases, so I'm not strict.",1
"I benefit from moderate to advanced detail, although I'd accept an outline approach for minor subtopics.",1
"I prefer an in-depth style, but I'd adapt if the course occasionally chooses a summary-level approach for certain segments.",1
"Depth is interesting to me, but I'm flexible with a shallow overview for sections deemed less essential.",1
"I lean toward fairly involved explanations, yet I'm not bothered if certain simpler lessons remain at a high level.",1
"I appreciate robust coverage, though I'd live with skipping a few advanced corners if time doesn't permit.",1
"I typically want more than just the basics, but I'd handle it if the instructor doesn't go too far into the weeds every time.",1
"Though I'd like to thoroughly dissect the material, I'd manage if we maintain an intermediate approach overall.",1
"I prefer a detailed journey, yet I'd be all right if some chapters are a swift overview to keep up pace.",1
"I am fine if we hover around mid-level detail, though I'd enjoy a deeper perspective on certain tricky areas as well.",1
"I appreciate a mostly comprehensive view, but I'm not strict if some content remains slightly superficial to save time.",1
"I favor deeper dives, but it's not a must for every single concept; I'll still follow if we lighten up occasionally.",1
"I like quite a bit of background info, though I'd accept if not all topics are heavily elaborated due to length constraints.",1
"I typically want advanced detail, but I'd be flexible if the course isn't geared toward extremely in-depth coverage on every module.",1
"I enjoy digging into complexities, though I'm cool with a simpler approach for straightforward topics.",1
"I like the chance to explore multiple layers, but I'd be patient if we only do a high-level pass in certain areas.",1
"I'm happy with mid-level coverage, but I'd be just as content if we occasionally slip into deep theory or stay shallow as needed.",1
"I prefer a robust explanation, but I'd settle for partial depth if it helps the flow of the course remain manageable.",1
"I usually want a bit more thoroughness, though I'd cope if some lessons remain quite cursory for novices.",1
"Moderate detail suits me, yet I'd welcome deeper expansions or simpler overviews depending on the significance of the topic.",1
"I find advanced discussions interesting, but I'd adapt if the overall approach is only somewhat beyond the basics.",1
"I love detail, though I'm open to a general overview in chapters that aren't as critical or that I'd revisit later.",1
"Mostly I'd like to see thorough coverage, but I'd be okay with a breezy approach for secondary topics if that's what's needed.",1
"I prefer deep analysis, yet I'm not against the course skipping certain advanced angles that might be tangential.",1
"I usually aim for more than a surface view, but I'm not adamant if time constraints keep us from diving too deeply in each lesson.",1
"I'm inclined to want comprehensive detail, but I'd be flexible if some areas are quickly introduced and saved for optional reading.",1
"I believe in going beyond the superficial, yet I'd accept if a few advanced concepts are not fully dissected.",1
"I'm partial to deeper content, though I'd manage if a portion of the material is taught in simpler, overview style.",1
"I like working through detailed explanations, but I'd be okay if some modules remain less exhaustive for brevity.",1
"I appreciate nuance and thoroughness, yet I'd settle for partial coverage if the instructor deems certain aspects low priority.",1
"I prefer a near-deep approach, though I'm not bound to it if skipping details helps us progress in a timely manner.",1
"I don't mind advanced topics, but I'd be happy if the course sticks to a mid-level approach for the bulk of material.",1
"I lean toward a deeper exploration, yet I'm not rigid if we occasionally just provide a big-picture summary instead.",1
"I prefer a good chunk of detail, though I'd remain flexible if certain sections are approached with broad strokes to keep pace.",1
"I would love in-depth coverage, but I'd be comfortable with a simpler overview if we revisit key points in detail later.",1
"I like thoroughness, yet I'm okay if a few lessons gloss over advanced aspects that may not be critical to the main objectives.",1
"I'm usually drawn to detailed breakdowns, but I'd be fine accepting shorter, more superficial coverage if needed in some spots.",1
"I think a moderately deep approach is best, but I'd be all right with only partial expansions in specialized topics.",1
"I want to see more than an introduction, but I'd adapt if only some lessons offer a comprehensive deep dive while others are basic.",1
"I prefer diving deeper, though I'm not upset if certain chapters remain quite general or skip advanced intricacies.",1
"A balanced approach between thorough and concise is ideal for me, and I'd handle it if some modules remain more high level.",1
"I like significantly detailed exploration, but I'd let the instructor decide which advanced sections are truly necessary to cover.",1
"I'm not expecting maximum detail in every topic, so I'd be satisfied with a moderate depth across the course.",1
"I love the idea of advanced coverage, yet I'm amenable to simpler approaches if that's how the course is structured overall.",1
"I thrive with deeper exploration, though I'd accept a cursory pass in certain areas if the teacher deems them less crucial.",1
"I'd rather go beyond the basics, but I'm not rigid if the main plan is to keep it at a mostly intermediate level.",1
"I enjoy a thorough approach, but I'd adapt if we only do an in-depth analysis on the more central topics, leaving others brief.",1
"Generally, I'd want to see nuance and detail, though I'm not strict if the course chooses to remain broad in a few sections.",1
"Going deeper is appealing, but I'm flexible if the general structure is to keep things more streamlined with less detail.",1
"I'm fine with stepping into advanced territory for key lessons, but I'd also be okay if simpler ones stay shallow or moderate.",1
"I'd like somewhat thorough coverage, though I'd be fine missing certain technical depths if time is short.",1
"While I appreciate thorough detail, I'd allow a more superficial approach if that helps cover more ground quickly.",1
"Balance is key: I'd like a deeper look, yet if the program doesn't delve deeply into every corner, I'll still manage.",1
"I do lean toward advanced coverage, but it's not an issue if we keep it accessible with fewer deep tangents in some chapters.",1
"I can handle fairly in-depth material, but I'd be okay if the course remains on a mild or moderate detail level overall.",1
"Although I'm curious about advanced intricacies, I'd cope if we keep those sections short or optional for those who want it.",1
"I usually like to know the finer points, though I'd accept a more general approach if that suits the majority of participants.",1
"I'm all for diving into complexities, but I'm also fine if we occasionally skip them in the interest of time or clarity.",1
"A deeper path is fun, but I'm flexible if some lessons revolve around a high-level overview to keep the pace up.",1
"I wouldn't mind a robust deep dive, yet I'd be okay if the course is mostly broad, with only a few deeper expansions sprinkled in.",1
"Detailed theory is great, but I'm open to a simpler track if the teacher decides not to go fully advanced on every subtopic.",1
"I prefer going beyond the basics, but I'd manage if certain optional complexities are left out for brevity.",1
"I want moderate detail at minimum, though I'd be happy if advanced sections come as an optional reading for further exploration.",1
"I typically lean toward thorough coverage, yet I'd be flexible if the course remains mostly an overview with some deeper modules.",1
"I like to explore complexities, but if the structure is more fundamental, I'd still make it work and learn what I can.",1
"I want enough detail to truly understand the material, though I'd accept if some parts remain fairly general or skip advanced aspects.",1
"An intermediate level is perfect for me, but I'd be okay with it drifting more advanced or more basic if that suits the group.",1
"Deep discussions intrigue me, but I'm not rigid if the class wants a simpler approach in certain sections.",1
"I find advanced expansions helpful, though I'd let them go if the instructor chooses to keep the coverage broad and simpler.",1
"I'm big on depth, but I'd adapt to a shallower method if it means finishing more material in limited time.",1
"I like analyzing key details, but I'd cope with skipping advanced content if it's too specialized or tangential.",1
"I prefer fairly detailed lessons, though I'd keep an open mind if the instructor streamlines them to a more superficial level in some areas.",1
"I normally want a thorough breakdown, though I'd accept if certain subtopics are summarized lightly to maintain momentum.",1
"I appreciate deeper insights, but I'd be okay if the focus stays on main concepts with minimal branching into advanced complexities.",1
"A well-rounded coverage is ideal, though I'm not demanding a full deep dive on each nuance if time is constrained.",1
"I'm up for exploring advanced topics, but I'm not disappointed if we only do a moderate-level approach for the majority.",1
"I like thorough explanations, but I'd accept a simpler outline for some modules if that helps keep the course on track.",1
"I gravitate toward advanced detail, but I'm open to the instructor's choice if a more mid-level approach is best for clarity.",1
"I enjoy complexities, though I'd handle a high-level approach for less relevant subtopics if that's how the course is built.",1
"For me, moderate depth is fine, and I'd be okay if there's occasional deeper expansions or shallower coverage as well.",1
"I prefer an in-depth style typically, though I'd settle for simpler coverage if we have limited time or a broad scope to address.",1
"I want decent detail in most areas, but I'd be flexible with skimming certain minor points for the sake of overall flow.",1
"Even though I'd love deeper dives, I'm not averse to a simpler overview if the teacher recommends it for certain lessons.",1
"I appreciate diving into details, though I'd accept if some advanced angles remain unexplored to avoid confusion or time drain.",1
"I'm fine with a relatively moderate or advanced approach, but I'd also be okay if only a portion is thoroughly dissected.",1
"I love layered explanations, yet I'm open to minimal coverage of specialized topics that aren't central to my main goals.",1
"Going deeper is usually my preference, but I'd adapt if the official plan keeps everything at an intermediate or simpler level.",1
"I expect more than a cursory introduction, yet I'd be calm if we don't dive into every advanced corner systematically.",1
"I can handle advanced theory, but I'd be fine if the course remains partially shallow to keep it approachable for everyone.",1
"I do well with thorough coverage, but I'd be flexible if we skip details that won't drastically affect understanding.",1
"I'm drawn to detail, though I'd let it slide if the instructor aims for broad conceptual coverage more than intricacy.",1
"A mainly mid-level approach is perfect, but I'd enjoy deeper expansions or simpler outlines depending on the chapter's complexity.",1
"I appreciate thoroughness, yet I'd accept if certain niche aspects are bypassed or only briefly mentioned.",1
"I like going step by step, but I'm not demanding an ultra-deep dive into every nuance; an overall moderate approach is enough.",1
"I usually thrive on detail, though I'd handle a surface-level pass if that's the chosen style for certain modules.",1
"I'm content with a moderate or deeper approach, but if the trainer chooses to keep it high-level, I'll still learn effectively.",1
"I favor an in-depth angle, but it's not mandatory for every lesson to be advanced; a mix is okay for me.",1
"I like thorough background info, but I'd survive a shallower overview if we move quickly through certain sections.",1
"Deep coverage is interesting, but I'm not fixated on it if the main objective is a simpler or broad understanding for the group.",1
"A moderate depth is enough for me, though I'd adapt if the course occasionally goes deeper or remains quite general in places.",1
I need everything to be extremely advanced and comprehensive; a shallow overview won't meet my expectations at all.,2
"It absolutely must stay very high-level, because I don't want or need any deep dives into micro-details.",2
"I insist on a fully thorough approach with absolutely no skipping of any advanced subtopic, or I'll lose interest quickly.",2
"There should be no deep details—only an absolute surface-level summary, or I'll be overwhelmed and drop out.",2
I require an exhaustive analysis of every facet; anything less than complete thoroughness won't be acceptable for me.,2
I won't settle for partial coverage; the lessons have to cover advanced theories in detail for each concept.,2
"I want strictly a bird's-eye perspective, meaning no heavy elaboration or extensive background that drags on.",2
"Without deep theoretical foundations in each area, I'm not continuing; every underlying principle must be explained fully.",2
"I cannot tolerate advanced complexities—keep it purely minimal with just the key points, or I can't follow.",2
"It must remain ultra-specific and detailed, with no point left uncovered, or I won't get what I need from this course.",2
"I only want a lightweight overview that never dives beneath the surface, or I'll feel it's too complicated to keep up.",2
There is no room for a shallow summary; the material must be thoroughly dissected down to advanced elements in every module.,2
"I'm only here for the broad strokes, so any advanced breakdown will instantly turn me away.",2
"I require maximum depth in all topics, from start to finish, with zero omissions or simplified sections allowed.",2
"Everything must be summarized at a top-level; if there's heavy detail, I'll be completely lost.",2
"I demand a deep, intricate approach, or I'll find the course too basic to be worth my time.",2
"My only interest is extremely shallow coverage, so if the teacher goes into deeper complexities, I'm out.",2
"It's absolutely necessary that we examine the advanced aspects thoroughly, ignoring simpler overviews for novices.",2
"I can't handle deep content, so it must remain broad and superficial with no intricate or extended elaborations.",2
I must have a heavily detailed structure that leaves no stone unturned; a mere overview won't suffice for me.,2
"If there's any advanced detail, I'd struggle and quit, so it strictly must remain at a superficial introduction level.",2
"I want the highest possible depth, with each concept fully expanded and analyzed to the smallest detail, or I won't find value.",2
I require a succinct summary with no advanced expansions; I'd be overwhelmed by complexities and would have to drop out otherwise.,2
"Don't skip or simplify anything—cover everything in advanced, methodical detail, or I'll lose motivation entirely.",2
"I only want a big-picture perspective with no diving deeper into theory or complexities, so keep it basic.",2
"No high-level shortcuts—I need thorough, advanced breakdowns in every lesson, or it's not worth doing for me.",2
"I prefer not to see complicated detail, so everything must remain at an easy, minimal coverage approach only.",2
I insist on fully advanced content; minimal or moderate coverage of the subject won't satisfy my learning requirements.,2
"I want no deeper expansions—just a fundamental overview, or I'll be frustrated by too much complexity.",2
"It must be deeply exhaustive, from theory to practice, with no bits glossed over, or I won't be able to thoroughly master it.",2
