Text,Constraint
"Although I'd be much happier if the content is in English, I can still manage if a few sections are in Spanish as well.",1
"I generally prefer everything in French, but if there's some bilingual material in English, I'm quite okay with that arrangement.",1
"Mostly I'd want the interface in German, yet I'm open to the occasional English term if it's necessary.",1
"I favor Japanese for the majority of the course, though I wouldn't mind if a few instructions pop up in Chinese.",1
"A fully Arabic version would be ideal, but I'm flexible enough to adapt if certain parts come in English, so it's not mandatory.",1
"While I'd love Portuguese for all the lessons, a small presence of Spanish or English wouldn't deter me from learning effectively.",1
"I'm used to reading Korean texts, though I'd consider some Japanese references if it clarifies advanced topics, so it's not set in stone.",1
"My preference is to keep the entire platform in Russian, but I'm not completely opposed to minor sections in English for broader context.",1
"I typically like everything in Chinese, but I'd tolerate a bit of bilingual support in English when it's relevant.",1
"Although I'd pick Italian as my primary language, I'd be alright with some French commentary if necessary, so I'm not too strict about it.",1
"I lean towards English materials for clarity, yet I'd be open to trying Spanish if there's a useful reason behind it, so it's a soft requirement.",1
"I think I'd do best in French, but I'd happily accept some additional examples in Arabic to compare translation methods.",1
"I'm comfortable working with Spanish, though I'd appreciate a hint of Portuguese if it doesn't complicate the core instructions.",1
"A majority of the text in German is what I'd love, but if there's an English overlay here and there, that's still fine for me.",1
"Japanese suits my reading habits best, though I'd be flexible with small bits of Korean for broader perspective, so I'm open to that.",1
"Primarily I'd like to see instructions in Arabic, though occasional English references wouldn't ruin it for me at all.",1
"Sticking to Russian as the main language is my preference, but I'd adapt if a bit of Spanish or French is included, so I'm flexible.",1
"A thorough Chinese version is ideal, yet I'd welcome English clarifications if certain topics get too complex, so it's not a deal-breaker.",1
"While I'd strongly favor an Italian interface, I'd accept pockets of German if they help illustrate different perspectives.",1
"Though I'd generally want everything in English, I'd accept a partial approach in Korean if there's a relevant reason for it.",1
"I'm mostly comfortable in French, but I'd handle a little Spanish if there's a real benefit to referencing it, so it's a preference, not a must.",1
"I prefer Spanish for reading speed, but I'd be okay with minimal Arabic content in the footnotes, so I'm flexible enough to see both.",1
"German is my main choice, yet I'd adapt to a few lines of Russian for specialized terms, so I'm not super strict about it.",1
"I guess I'd prefer Japanese, though I'd be open to some Chinese commentary for advanced sections, if it helps with deeper understanding.",1
"Being used to Arabic texts, I'd like that for the entire course, but I'm not ruling out some English references if they're helpful.",1
"If it's mostly Russian content, I'm satisfied, but I'd accept a few clarifications in French if it's truly necessary.",1
"I want the user interface in Chinese for convenience, yet I'd welcome short English explanations in advanced modules.",1
"Italian is my top pick, but I'd be intrigued to see a sprinkling of Portuguese here and there, so it's not locked down to only one language.",1
"English is obviously easiest for me, though I'd be open to Spanish subtitles if they're relevant to certain segments, so I'm open-minded.",1
"I tend to follow French content quickly, yet I'd consider German references as an added bonus, so it's a preference but not an absolute need.",1
"Spanish typically suits me, though I'd be comfortable with occasional English expansions, so it's not mandatory to keep it purely Spanish.",1
"German coverage is what I'm used to, but I'd handle partial Japanese if it's beneficial to highlight cultural differences.",1
"I mainly want Japanese text, though I'd take a little Arabic if it rounds out certain background details, so it's somewhat flexible.",1
"Arabic is my main request, but I'd be open to English if the content is difficult to translate fully, so there's some flexibility in that.",1
"I do well with Russian reading, yet I'd handle some Spanish references, especially if they provide valuable context.",1
"Chinese is my preference, although I'd allow minor bits of Japanese if they expand on certain advanced topics in a unique way.",1
"Italian is favorable for me, but I'd endure some English commentary if it's truly helpful, so I'm not fully opposed to mixing languages.",1
"Mostly I'd want English, but I'd be excited to see some French additions that might enhance the explanation of technical terms.",1
"French is what I'd prefer overall, though I'd check out an Arabic footnote or two if they add interesting cultural context, so it's soft for me.",1
"Given my reading speed in Spanish, I'd like that primarily, but I'm not shutting out some Portuguese references if it's relevant.",1
"German is easiest for me to parse, but I'd read short English text if there's a specific reason for it, so I won't say no to that possibility.",1
"While I'd like a Japanese environment, I'd be fine with minimal Chinese terms if they provide clarity on complex ideas, so it's optional.",1
"Sticking to Arabic is ideal, but I'd accept some bilingual English support in sidebars if that helps unify the user group, so I'm flexible.",1
"I'm comfortable with Russian, though I'd be open to seeing certain passages in German for cross-linguistic comparisons, so it's a preference more than a demand.",1
"I'd love to see a fully Chinese layout, but I'd be okay if an English translation is offered in small sections for broader reach.",1
"An Italian-based course is my first choice, but I'd be alright with partial references to Spanish if that helps explain certain terms.",1
"English content is the simplest for me, though I'd like a bit of Japanese for cultural flavor if it's not too disruptive, so I'm open.",1
"French is my comfort zone, but I'd be willing to read short Arabic text if there's an interesting perspective attached, so it's not a must, just a desire.",1
"I handle Spanish reading well, but I'd be open to small references in English that clarify advanced concepts, so I'm fairly flexible.",1
"German is my baseline, though I'd be fine if a little Russian sneaks in for relevant historical notes, so it's not strict at all.",1
"Japanese is nice for me, but I'd accept some snippets of Korean if they highlight contrasting grammar points, so it's definitely flexible.",1
"Arabic coverage is best, though I'd consider small English inserts if there's no direct translation for certain technical jargon, so it's a soft requirement.",1
"I strongly prefer Russian texts, but I'd allow a sprinkling of French if it enriches the discussion in meaningful ways.",1
"Chinese resonates with me best, though I'd be intrigued by an Italian footnote or two if there's a relevant reason, so it's purely optional.",1
"Italian is my top preference, but I'd be open to minimal German phrases if they highlight specific technical contexts.",1
"I do better with English overall, yet I'd enjoy some Arabic references, especially if they provide deeper cultural insights, so I'm not stuck on monolingual material.",1
"Given I'm fluent in French, I'd like that, but I'd also be open to some Russian side references if the content warrants it, so I'm flexible.",1
"Spanish is easiest for me, though I'd accept some Portuguese footnotes to compare linguistic similarities, which is interesting.",1
"German is workable for me, but I'd be fine with an English glossary if we run into specialized vocabulary, so I'm open-minded.",1
"Japanese is my main reading language, though I'd adapt if there's a Chinese section for advanced theory, so it's not strictly one-language for me.",1
"Arabic is comfortable, yet I'd see the value in partial English references for broader academic acceptance, so I'm flexible on that.",1
"If it's mostly Russian, I'd be good, but I'd consider small Spanish highlights if they add an important dimension, so I'm not fixed in stone.",1
"A predominantly Chinese approach works for me, yet I'd be open to minimal French if it clarifies historical contexts, so it's somewhat flexible.",1
"Although I'd favor an Italian interface, I'd tolerate some Korean text if it fosters interesting comparative insights, so it's not a big deal for me.",1
"I love English materials, but I'd be curious to see how a Japanese version might read for advanced sections, so I'm definitely open to that combination.",1
"While French is my go-to, I'd be okay with partial Arabic commentary if it enhances the conversation on specialized topics, so I'm quite easygoing.",1
"For me, Spanish is simplest, but I won't reject the presence of German references, especially if they link to certain cultural aspects.",1
"German suits me best, but I'd see the utility of a small Chinese excerpt if it demonstrates alternate translations, so I'm flexible enough for that.",1
"Japanese is my preference, though I'd embrace some short English notes for scientific terminology, so there's no absolute restriction from me.",1
"I operate well in Arabic, but I'd be open to seeing a few Russian statements if they're relevant to a specialized domain, so I'm not strictly opposed.",1
"Russian is my main language, but I'd appreciate minimal French expansions if that helps clarify advanced grammar points, so I'm somewhat flexible.",1
"Chinese is how I'd prefer to study, though I'd also handle some Spanish text if it references key cultural examples, so I'm quite open.",1
"Italian might be my top pick, but I'm not closing the door on English explanations if they come with added depth, so it's not a strict demand.",1
"English is the standard for me, but I'd incorporate small bits of Arabic if they add interesting layers, so I'd say it's fairly soft.",1
"Sticking to French is what I'd do best, though I'd be fine with a page or two in Japanese if there's a unique insight, so I'm flexible.",1
"Spanish reading is comfortable, but I'd be open to cross-checking certain terms in Portuguese, so I'd say I'm not strictly monolingual in preference.",1
"German is easiest for me, but I'd handle small translations in Korean if that expands our coverage, so it's definitely flexible.",1
"A Japanese version is appealing, though I'd also accept an Italian add-on if there's a beneficial reason, so I'm not locked into one language alone.",1
"I'd prefer Arabic overall, but I'd consider minimal Chinese references if they provide essential clarifications, so I'm relatively open.",1
"I'm used to Russian, yet I'd read short English notes if they specifically address advanced or missing concepts in the main translation, so it's all good.",1
"Chinese is a strong preference, but I'd be alright with a small Japanese section focusing on advanced grammar intricacies, so it's not mandatory to remain single-language.",1
"Italian resonates with me, but I'd indulge a few Spanish lines if they're relevant, so it's definitely not a strict requirement to stay purely Italian.",1
"Mostly I'd go for English, but I'd be intrigued by some Arabic expansions if they're beneficial, so I'd consider them optional but welcomed.",1
"French is nice for me, yet I'd accept partial German if the content covers specialized historical references, so it's a preference rather than a necessity.",1
"Spanish is quite straightforward for me, though I'd be game to see some small references in Russian, so I'm not opposed to that idea.",1
"German is my reading language, but I'd be okay with small French segments for a deeper cross-cultural perspective, so I'd keep an open mind.",1
"Japanese is what I'd typically go for, but I'd also accept limited English if it explains certain niche fields better, so it's soft in that sense.",1
"Arabic is my comfort zone, but I'd handle minimal Spanish if it really adds something crucial to the course, so I'd say it's flexible for me.",1
"Russian coverage is ideal, though I'd appreciate a dash of Korean for specialized grammar notes, so I'd welcome that combination as an option.",1
"Chinese is my go-to, but I'd be curious about a sprinkling of French for advanced cultural context, so I'm open if that arises.",1
"Italian is what I'd prefer, though I'd be okay with short German references if they highlight unique technical aspects, so it's not essential to remain purely Italian.",1
"English feels easiest, but I'd be open to trying out partial Korean if there's a reason for it, so I'm not entirely fixed on English only.",1
"French fits my reading style best, though I'd read small Arabic sections if we need them for clarifications, so there's some room there.",1
"I'm mostly a Spanish reader, but I'd accept minimal English expansions if they highlight advanced theoretical points, so it's a preference but not a constraint.",1
"German is comfortable, though I'd take a small portion in Japanese if it truly reveals interesting cultural differences, so I'm flexible on that.",1
"A mostly Japanese approach is preferred, yet I'd incorporate minor Chinese references for improved coverage, so it's not absolutely monolingual for me.",1
"Arabic is my prime focus, but I'd read a snippet of Portuguese if it clarifies or contrasts certain textual interpretations, so I'd keep an open mind.",1
"Given my Russian background, I'd love that primarily, but I'd be open to fleeting French mentions to broaden the perspective, so it's not set in stone.",1
"I definitely want Chinese as the main language, though I'd consider short Spanish examples if they serve a deeper explanation, so I'm flexible.",1
"Italian is appealing to me, but I'd also enjoy an English side note if there's a direct benefit for advanced learners, so it's not a must-have limitation.",1
"English is standard for me, but I'd try French if it's not too confusing to switch, so I'd label it a soft preference only.",1
"Given I read French comfortably, I'd handle Spanish if that language offers certain specialized references, so I'm not limiting it to a single language.",1
"Spanish is my day-to-day reading, yet I'd see value in minimal Arabic texts for a unique angle on certain topics, so I'm open to it.",1
"German works for me, though I'd be keen on a little Italian if there's a direct application or relevant cross-language tie-in, so I'm flexible.",1
"Japanese is a good fit, but I'd dabble with English if we find specialized or untranslatable sections, so I'd call it a preference, not a firm rule.",1
"Arabic is quite comfortable, but I'd accept some French expansions if they're particularly illuminating, so it's definitely workable for me.",1
"I'm typically set on Russian, though I'd try Portuguese if there's an important cultural context that might be lost otherwise, so I'm open-minded.",1
"Chinese is best for my reading speed, though I'd include small mentions of German if we want to compare structures, so I'm fairly flexible.",1
"Italian is enjoyable for me, but I'd also be fine with an occasional Spanish reference if it won't overshadow the main content, so it's a soft approach.",1
"While I default to English, I'd appreciate some Japanese text if it clarifies local nuances or domain-specific terms, so I'm not locked in.",1
"French is my baseline, but I'm open to seeing Korean references if there's a benefit in exploring grammar from multiple angles, so I'd welcome that possibility.",1
"As a Spanish speaker, I'd prefer that for clarity, but I'd adapt to a bit of Chinese if it offers advanced examples, so I'm flexible enough.",1
"German suits me the most, though I'd read short Russian passages if they're relevant to historical or cultural points, so I'm not insistent on one language only.",1
"A Japanese approach is ideal, yet I'd be curious about minimal Arabic insertions if they provide unique insight or context, so I'm open to that arrangement.",1
"I'd like primarily Arabic, but I'd consider English in some advanced modules if translation difficulties arise, so it's a preference, not a demand.",1
"Russian is my strong suit, though I'd be fine with short French expansions if they're logically beneficial for the subject at hand, so it's somewhat flexible.",1
"Chinese is the main language I'd want, though I'd allow minor Japanese references if they highlight interesting linguistic parallels, so I'm not completely rigid.",1
"I find Italian reading quite pleasant, but I'd incorporate Spanish clarifications if that helps create a more inclusive environment, so I'd be open to it.",1
"Although I'd prefer English, I'd accept partial German if there's a valid reason, so there's definitely some wiggle room in my preference.",1
"French is good for me, yet I'd be okay with seeing a small portion in Arabic if we need coverage for specialized concepts, so I'm flexible with that aspect.",1
"For standard usage, I'd go with Spanish, but I'd consider reading a bit of Korean if it enriches certain segments, so I'm not totally opposed to mixing.",1
"German is straightforward for me, but I'd also appreciate short Chinese bits if they exemplify certain advanced structures better, so it's definitely a possibility.",1
"Japanese is my chosen path, yet I'd be receptive to small English translations if we stumble on untranslatable idioms, so I won't block that idea.",1
"Arabic is quite workable for me, though I'd let a bit of Russian content slip through if there's some deeper academic insight to be gained, so it's not a strict rule.",1
"Russian coverage is usually my focus, but I'd read a snippet or two in French if it truly supplements the main text, so I'm flexible enough to allow it.",1
"A Chinese approach is favored, yet I'd see the logic in minimal Spanish usage for clarifying certain cultural points, so I'd call that a preference, not a requirement.",1
"I'm partial to Italian, but I'd keep an open mind for an English summary if it helps unify the audience, so I'd say it's optional but acceptable.",1
"English is typically my comfort zone, yet I'd try small bits of French if they're valuable for more nuanced topics, so I'd be open to that approach.",1
"French reading is comfortable, but I'd incorporate minimal Arabic if there's a strong necessity for it, so I'm somewhat flexible in that sense.",1
"Spanish content is absolutely best for me, although I'd see the advantage of some German references if they expand certain areas, so I'd not object to that approach.",1
"German fits me well, yet I'd be fine with short Japanese expansions if that yields deeper insights, so it's definitely workable for me.",1
"I'd do best in Japanese, but I'd accept a bit of Arabic if there's a reason to cross-compare concepts, so I'm open-minded about it.",1
"Sticking to Arabic is comfortable, though I'd glance at minimal Portuguese references if they're used to illustrate specific terminologies, so I'm not fully opposed.",1
"Russian is my strong preference, but I'd be lenient if there's short English text for more specialized or global topics, so it's not a firm line.",1
"Chinese is how I'd like to proceed, though I'd consider minimal French inclusions if they highlight unique aspects, so I'm flexible on that usage.",1
"I prefer an Italian-based approach, but I'd let some Spanish slip in if it clarifies ambiguous points, so I'd label it a soft preference overall.",1
"English is simpler for me, though I'd be open to a few advanced discussions in Japanese if there's a strong rationale, so I'm not dead set on one language.",1
"Given I'm used to French, I'd also be open to partial German references if they significantly contribute to the learning, so it's flexible for me.",1
"Spanish is my daily reading, yet I'd be fine with short Arabic expansions if that fosters inclusivity, so it's definitely a preference but not an absolute limit.",1
"German reading suits me, though I'd accept minimal Chinese aspects if they highlight certain domain-specific expansions, so I'd keep an open mind.",1
"Japanese is fantastic for me, but I'd incorporate small English clarifications if there's advanced jargon to be tackled, so I'm flexible in that way.",1
"I mostly do Arabic, though I'd handle a bit of French if it doesn't overshadow the main text, so I'd call it a preference rather than a must.",1
"I'm primarily a Russian reader, but I'd see the advantage in referencing Spanish for certain cultural contexts, so I'm definitely not restricting that option.",1
"Chinese content suits me best, though I'd look at minimal Japanese references if they're relevant to advanced grammar or usage, so it's optional but appreciated.",1
"I'd choose Italian overall, but I'd be curious about an English note if it helps clarify unique expressions, so I'm not set in stone about staying strictly Italian.",1
"English is typically my approach, though I'd be eager to try small Korean references if that broadens the perspective, so I'd definitely allow it.",1
"French is a strong preference for me, but I'd let minimal Russian references slide if they add something meaningful, so I'd label that a soft approach.",1
"My go-to is Spanish, though I'd be open to bits of German if they highlight specialized cultural points, so it's not mandatory to remain purely Spanish.",1
"I prefer German for standard usage, but I'd adapt to minimal Arabic expansions if they're beneficial to the context, so I'm fairly flexible there.",1
"Japanese is what I'd prefer across the board, though I'd allow small Chinese mentions if it enriches the advanced sections, so it's not rigid for me.",1
I can't proceed unless the entire curriculum is written in English with absolutely no other language involved.,2
"It must be fully in French or else I'll be completely lost, so there's zero flexibility on that point.",2
"I only speak Spanish fluently, meaning the entire course must be in Spanish exclusively, with no exceptions.",2
"Because I don't know German well, the entire text must remain in Japanese, and that's a strict requirement.",2
"If it's not entirely in Arabic, I won't be able to participate whatsoever, so it's mandatory for me.",2
"Under no circumstances can we mix any language other than Portuguese, as I can only read Portuguese sufficiently to follow along.",2
"My system doesn't allow me to work in a secondary language, so everything must be in Korean from start to finish.",2
"I must have Russian for the entire program, or I'm simply unable to comprehend any of it.",2
"Without a 100% Chinese interface and content, I can't continue, so there's no room for other languages here.",2
"It's absolutely critical that the course is entirely in Italian, or I won't understand a single part of it.",2
"I strictly need the content in English alone, because I'm not fluent in reading or listening to anything else.",2
"The complete set of instructions must remain in French, or I'm completely cut off from following the lessons.",2
"If there's even a small portion not in Spanish, I'll be lost, so it must be exclusively Spanish the whole way.",2
"German is the only language I can handle well, so there's no allowance for mixing in other languages, even partially.",2
"I need every single word in Japanese, with no deviation into another language at all, or I'm out.",2
"Arabic is the sole language I can manage, so it's mandatory that everything be in Arabic with no secondary language introduced.",2
"Since I'm only fluent in Russian, the entire resource must be in Russian, or I cannot proceed effectively.",2
"There's no possibility of me understanding if the material isn't entirely in Chinese, so I'm afraid it's a strict requirement.",2
"Italian is my only viable language, so please ensure the entire content is in Italian, or I won't be able to follow.",2
"I absolutely must have the content in English exclusively, because I cannot read or interpret other languages sufficiently.",2
"All instructions and references have to remain in French, with no mixing of foreign languages, or I'll be lost.",2
"For me to continue, everything must be in Spanish alone; otherwise, I'd fail to grasp critical details.",2
"I can only interpret German accurately, so there's no leeway to include other languages in the official materials.",2
"Unless it's fully in Japanese, I won't manage to complete the tasks, so there's no alternative for me.",2
The entire course content must stay in Arabic; any deviation to another language renders it unusable for me.,2
"I must have absolutely everything in Russian, or I'm out of luck, as I don't speak or read another language well.",2
"It's critical for me that the platform is entirely in Chinese, with no occasional references to a different language.",2
"I require a fully Italian environment, so any additional language will disrupt my comprehension entirely.",2
"All text and audio must be in English, leaving no room for bilingual content, or I can't keep up.",2
"I'm only proficient in French, so the entire interface and lessons must remain in French, no partial translations allowed.",2
"The content can't feature any language besides Spanish, or I'll be completely unable to continue.",2
"I insist that every last component be in German, or there's no feasible path for me to understand the material.",2
"Without a fully Japanese transcript, I'm unable to proceed with the course, as I can't decipher other scripts adequately.",2
"An Arabic-only course is the only option for me, or I'd fail to follow the instructions, given my language limitations.",2
