Text,Constraint
"I used to practice machine learning with scikit-learn, yet I'd be open to starting from the fundamentals of linear regression again.",1
"I studied discrete math a few semesters back, so I'd happily see it reintroduced step by step in the course for thoroughness.",1
"Though I tackled advanced data structures, I'd be good with a gentle reintroduction to make sure we all have the same baseline.",1
"I have a moderate handle on probability distributions, but I'd be flexible if the course starts from random variables and basic probability definitions.",1
"I've done a bit of front-end coding, but I'm all right with going through HTML and CSS from zero so nobody is confused.",1
"I've experienced Docker usage in my last job, though I'd be cool if there's a fundamental explanation of how containers work for novices.",1
"I touched on advanced OOP patterns, but I'd be open to a systematic approach that begins with the simplest design principles.",1
"I picked up some knowledge of discrete math proofs, yet I'd be okay if we illustrate them in a beginner-friendly manner for all.",1
"I took a course on React, though I'd be fine starting from the fundamentals of JavaScript again if that's the group level.",1
"I have a partial understanding of algorithms, but I'd prefer a robust introduction so I don't miss any conceptual corner cases.",1
"I tried some DevOps stuff, but I'd be glad if the session covers it from a high-level perspective for those brand new to it.",1
"I can handle simpler coding tasks, though I'd be fine if the course includes thorough definitions of variables and loops again.",1
"I've seen advanced math in other contexts, but I'm okay if the program doesn't assume too much from my memory of it.",1
"I learned database normalization once, though I'm happy to revisit the core concepts so the class moves together cohesively.",1
"I'm aware of multi-variable calculus, but I'd be content focusing on basic derivatives if the course doesn't require more depth.",1
"I studied more advanced data analysis, but I'd be open to a refresher on reading CSV files and doing simple cleaning steps in Python.",1
"I covered object-oriented concepts in Java, but I'd like a thorough step back so new learners don't miss the fundamentals.",1
"I have a fair understanding of discrete structures, but if we do a complete introduction again, I'd still pick up something new.",1
"I read about concurrency, yet I'd be fine if we skip advanced parallel programming so it doesn't overwhelm novices early on.",1
"Though I've seen advanced front-end frameworks, I'd be okay if the course covers CSS basics extensively for clarity.",1
"I tackled advanced statistics, yet I'd welcome a recap of distributions if it ensures thorough coverage for everyone.",1
"I've messed around with machine learning libraries, but I'd prefer a methodical reintroduction to each algorithm from scratch.",1
"I learned Java fundamental syntax, but I'd appreciate a complete re-run that ensures absolute clarity for all participants.",1
"I'm pretty sure I know standard data structures, yet I'd be good with a from-the-ground-up approach so nobody is left behind.",1
"I've tried building web apps in the past, though I'd be happy if we restate how web servers and clients interact from scratch.",1
"I tested a few algorithms for coding challenges, but I'd be fine if we start from sorting and searching to ensure comprehensive coverage.",1
"I've used Git in collaboration, but I'd appreciate an introduction again to commit, branch, and merge for newbies in the group.",1
"While I'm used to object-oriented design, I'd be patient if the course re-explains classes, objects, and methods in detail.",1
"I picked up some network engineering concepts, though I'd be absolutely fine starting from IP addresses to advanced routing, step by step.",1
"I have studied advanced mathematics, but it's fine if the course only lightly touches on simpler algebra or geometry to get by.",1
"I've done code in multiple languages, but I'd be okay with an entirely beginner approach in one language to unify the group's skill set.",1
"I used JavaScript frameworks, yet I'd be comfortable if we rehash the differences between frameworks and libraries from the start.",1
"I read a bit on DevOps pipelines, but I'd be all right if we begin by explaining CI/CD to those who have never heard of it.",1
"I'm familiar with Docker Compose, but I'd be good if we break down the fundamentals of container orchestration for clarity.",1
"I once took a crash course in discrete math logic, though I'd appreciate a slower pace so I don't skip subtle details.",1
"I have some background in functional programming, yet I'd be okay if the course only teaches imperative style at first.",1
"I messed with graph theory, but I'd prefer a step-by-step explanation of BFS and DFS to confirm my understanding is solid.",1
"I previously used the command line for Git, yet I'd be open to a simple GUI-based approach for the sake of new participants.",1
"I learned about advanced calculus, but I'd be okay focusing on derivatives and basic integrals if that's the intended level.",1
"I'm proficient with OOP, but I'd be absolutely fine going through method definitions and object instantiation from zero again.",1
"I've done some advanced data science, though I'd be flexible if we only examine simpler tasks like linear regression first.",1
"My knowledge of web dev is moderate, but I'd be comfortable if the course covers pure HTML, CSS, and basic JavaScript for novices.",1
"I recall a bit of advanced statistics, yet I'd prefer we start with the basics of mean, median, and variance to unify the class knowledge.",1
"Though I'm quite comfortable coding in Python, I'd happily take a short refresher on fundamental syntax so we skip no details.",1
"I have experience with data structures, but I'd be perfectly okay if the teaching starts at arrays, linked lists, and other fundamentals.",1
"While I've built complex backend systems, I'd be fine if the course doesn't assume that and teaches the basics of routing and controllers.",1
"I've explored advanced neural networks, but I'd be open to a gentle reintroduction to machine learning from the ground up.",1
"I studied discrete math in detail, though I'd be okay if we start from definitions of sets, subsets, and cardinality for thoroughness.",1
"I know Java well enough, but I'd be flexible if we spend time on the fundamentals of data types and control flow for completeness.",1
"I've encountered probability trees and Markov chains, but I'd be fine if the program starts at the basics of event probabilities first.",1
"I tried Docker networking, yet I'd appreciate a recap on how containers communicate so the group is aligned.",1
"I've previously used version control in large projects, but I'd go through the basics of branching strategies so everyone is on the same page.",1
"Even though I'm well-versed in data structures, I'd not mind a slow-paced coverage that ensures no confusion for novices.",1
"I took an OOP course focusing on Python classes, but I'd be all right if we circle back to syntax for the brand new folks.",1
"I have some web dev background, but I'd prefer a from-zero approach if it means thorough coverage for absolutely everyone.",1
"I'm fairly strong in math, yet I'd accept an approach that doesn't rely heavily on advanced theorems if the class doesn't require it.",1
"I learned basic Git branching, but I'd be totally fine if we re-explain merges, pull requests, and best commit practices from scratch.",1
"Though I know discrete structures, I'd be okay reviewing how logic gates or truth tables map to real-world scenarios for newcomers.",1
"I have some machine learning basics, yet I'd be absolutely comfortable if the course builds from a simple regression model onward.",1
"I used to program data structures in C, but I'd be fine if we redo them in a more modern language at a gentle pace.",1
"While I'm not brand new to statistics, I'd be open to covering descriptive analysis meticulously for those who are starting out.",1
"I dabbled in front-end coding, but I'd be good with reintroducing DOM manipulation from ground level so everyone grasps it thoroughly.",1
"I tried implementing advanced algorithms, but I'm fine if we start with bubble sort or selection sort for conceptual clarity.",1
"I'm self-taught in Python, yet I'd prefer a structured approach that doesn't assume I'm fully confident in all aspects.",1
"I learned discrete math problem-solving, but I'd be open to a gentle approach to proofs for novices in this area.",1
"I took an advanced course in data structures, though I'd be okay if we systematically go from arrays to advanced trees again.",1
"I covered software engineering best practices, but I'd be happy if the course doesn't assume prior knowledge on that front.",1
"I studied basic Docker usage, yet I'd be open to a simpler introduction that carefully explains images and containers for all skill levels.",1
"I see DevOps as valuable, but I'd be fine if we define it thoroughly from a zero-experience viewpoint for those brand new to it.",1
"I can do some stats on large datasets, but I'd be flexible if we start with small-scale examples that illustrate fundamental concepts clearly.",1
"I used Linux for development, but I'd be all right if we treat the environment as if we've never used a command line before, for others' sake.",1
"I recall advanced combinatorics, yet I'd be fine if we begin from simple permutations and combinations for novices in discrete math.",1
"I've tested neural nets, but I'd be more than happy to step back to logistic regression if that’s the baseline needed here.",1
"Even though I've done full-stack dev, I'd be game for a thorough reintroduction to RESTful APIs if it helps unify participants.",1
"I used an advanced branch strategy in Git, though I'd be okay stepping back to a simpler approach that clarifies the fundamentals for the group.",1
"I've tinkered with advanced concurrency, yet I'd accept that we might only do single-threaded code if the course isn't focusing on parallel tasks.",1
"I have a moderate familiarity with data mining, but I'd be all right if the course is mostly about introductory analysis techniques first.",1
"I coded in Java many times, but I'd be fine if you assume I'm a novice just to ensure no steps are skipped in the process.",1
"I'm okay with re-hashing algorithms from a beginner's perspective, even though I've used them in advanced coding challenges before.",1
"I once studied discrete math proofs thoroughly, but I'm open to re-verifying those basics for completeness and better group synergy.",1
"I have done some web dev using frameworks, but I'd be cool if we stick to vanilla HTML/CSS/JS for an initial foundation.",1
"I taught myself the fundamentals of Docker, yet I'd happily go over everything once more to clarify any advanced aspects I missed.",1
"Though I'm aware of advanced linear algebra, I'd be okay if we revolve around simpler matrix operations at the start.",1
"I read about intricate DevOps pipelines, yet I'd be fine if we keep it at a broad overview for now, focusing on continuous integration basics.",1
"I'm versed in advanced probability, but I'd be flexible if the course aims to introduce probability in a very rudimentary manner first.",1
"I studied large-scale data structures, but I'd be open to stepping through simpler ones to see if there's a fresh perspective on them.",1
"I messed with some advanced Python libraries, though I'd be good if we act like it's everyone's first experience with Python for consistency.",1
"I have an intermediate hold on statistics, yet I'd be glad if we start from the concept of normal distributions for thoroughness.",1
"I find coding in multiple languages feasible, but I'd be fine if the course picks one language and slowly covers all the basics for uniformity.",1
"I did the basics of an OS course, though I'd prefer if we reexamine process scheduling from a fundamental standpoint for clarity.",1
"Though I remember advanced geometry, I'd be okay if the course only uses simpler shapes to illustrate standard concepts, ensuring no one is lost.",1
"I dabbled with advanced cryptography, yet I'd be fully onboard if the course doesn't assume such knowledge and starts simpler.",1
"I have the gist of machine learning pipelines, but I'd appreciate a methodical approach that leaves no newbie behind.",1
"I studied some complex coding patterns, but I'd be open to a fundamentals-first approach, ensuring a sturdy conceptual foundation.",1
"I have strong knowledge of data structures and algorithms, yet I'd be perfectly okay with reevaluating them from the ground up in the course.",1
"I've played around with microservices design, but I'd be tolerant of a slow introduction to simpler monolithic architectures first.",1
"Though I'm confident in advanced math, I'd be flexible if the lessons revolve around basic arithmetic to accommodate everyone else.",1
"I tested out advanced front-end frameworks, yet I'd be good with initial HTML fundamentals to unify the skill level across participants.",1
"I'm comfortable with concurrency in Python, though I'd accept if the course sticks to single-threaded examples to keep it straightforward.",1
"I have an academic background in discrete math, but I'd be okay if the course starts with fundamental definitions and logic statements for clarity.",1
"I only partially recall advanced statistics, so I'd be happy if the instructor covers simpler parametric tests from the start.",1
"I code regularly in Java, yet I'd be open to seeing a fundamental explanation of the language for absolute novices if that's the plan.",1
"I've tried building Docker containers, but I'm not strictly opposed to retreading container basics so everything is crystal clear.",1
"I'm decently skilled at advanced algorithms, though I'd be fine if we talk about bubble sort or insertion sort thoroughly before bigger topics.",1
"Though I've studied big data systems, I'd be okay focusing on small dataset manipulations for a more step-by-step learning approach.",1
"Even though I've done front-end frameworks extensively, I'd be good with thoroughly explaining DOM elements for newbies in the class.",1
"I need a solid background in basic algebra; without it, I won't follow the material properly, so it's non-negotiable.",2
"It's absolutely essential to have prior exposure to Python programming, or the coding sections will be unmanageable for me.",2
"Unless I've mastered data structures in a previous course, I can't proceed confidently here, so it must be required knowledge.",2
"I can only keep pace if I'm already well-versed in machine learning fundamentals, so that knowledge is mandatory for me.",2
"If I don't have discrete math under my belt, I'll be totally lost in the logic and set-related content, so it's crucial.",2
I won't be able to handle the advanced statistics portion unless I've already studied probability and distributions thoroughly.,2
"Full comprehension of object-oriented programming is necessary to move forward, so I'd need that as a strict requirement.",2
"I can't handle the upcoming complexities if I haven't done web development basics, making it a hard prerequisite for me.",2
"Without a thorough grasp of algebraic formulas, I'd be stuck, so it's imperative that I'm already comfortable with them.",2
"If I haven't learned about algorithms previously, I won't keep up, so advanced algorithmic knowledge is non-negotiable.",2
"A strong foundation in front-end technologies is essential, or I'd be incapable of integrating new frameworks properly.",2
"I must have studied Java fundamentals, or the entire section on building applications won't make sense to me at all.",2
"I absolutely require an understanding of database design beforehand, or I'd fail to keep track of normalization concepts.",2
"It’s critical to have advanced calculus knowledge; otherwise, I'm not going to manage the heavy math demands in this course.",2
"If I'm not already fluent in statistics, there's no chance I'd interpret the data analysis modules properly, so it's mandatory.",2
"I must be proficient in Docker usage, or I'd be clueless about container workflows from day one.",2
"Since the material references advanced discrete math, I need to have completed a thorough discrete course beforehand.",2
"I can only proceed if I'm very comfortable with probability theories, or I'd fail to understand half the discussions.",2
"A background in computer architecture is absolutely vital, or I'd be lost in the deeper hardware-level optimizations part.",2
"Without a prior object-oriented design course, I'd be stuck with the entire structure of the application, so it's non-negotiable.",2
"I can't skip into advanced data structures if I haven't fully learned the basics of arrays, lists, and trees from before.",2
"I need a firm grounding in concurrency concepts, or I'd break the code when it comes to multi-threading tasks, making it essential.",2
There’s no way to complete the machine learning projects if I haven't mastered Python syntax and libraries beforehand.,2
"Unless I'm comfortable with version control systems already, I'd be unable to keep track of merges and branches effectively.",2
"Being versed in advanced equations is a must, because the curriculum won't cover simpler math again.",2
I won't keep up with discrete mathematics discussions if I haven't seen set theory or logic proofs in detail prior to this.,2
"Knowing web development from the ground up is essential to follow the advanced front-end topics, so there's no leeway on that.",2
"I must have done an in-depth course on DevOps concepts, or I'd be in the dark about continuous integration and delivery pipelines.",2
"If I'm not already experienced with Docker, I'd fail to grasp the container orchestration portion, which is mandatory in the lessons.",2
"I absolutely must have a handle on fundamental JavaScript, or I'd be unable to modify any part of the codebase in the course.",2
"Without prior knowledge of data structures, I'd be lost once we jump into advanced manipulations, so it’s definitely required.",2
"I need a thorough background in advanced algorithms, because the course won't re-explain them from the ground up.",2
It's impossible for me to do the discrete math portion if I haven't passed an introductory discrete course already.,2
"Prior exposure to object-oriented patterns is a hard prerequisite, or I'd be confused about the code organization from day one.",2
"Basic calculus is mandatory, because the sections on optimization won't make any sense if I haven't learned derivatives and integrals.",2
"I can only proceed if I'm already comfortable with the fundamentals of Python, as there's no plan to teach syntax from scratch.",2
"Because the course relies on advanced data structures, not knowing stacks, queues, or linked lists ahead of time is a deal-breaker.",2
"I won't survive the advanced web dev content if I'm not intimately familiar with HTML, CSS, and JavaScript from prior study.",2
"If I haven't used Git extensively, I'd be lost in the collaboration segments, so it's absolutely required knowledge.",2
"It's crucial that I've done some machine learning basics before, or I'd be perpetually behind in the advanced modules here.",2
"I need discrete math knowledge at an advanced level, or I'd struggle with the graph algorithms and complexity topics.",2
"Proficiency in statistics is non-negotiable, because the entire data analysis portion depends on that existing skill.",2
"I'm forced to have a thorough background in object-oriented design, or I'd fail each hands-on assignment in the course.",2
"Only those who've completed a prior web development module can keep up with these new frameworks, so it's mandatory for me.",2
"If I haven't taken an advanced math class, I'll be totally unable to follow the equations we'll use, so it's a strict prerequisite.",2
"I must come in knowing concurrency basics, or I'd be unable to design multi-threaded solutions that the course demands.",2
"If I'm not adept at fundamental data structures, I'd be stuck the moment we talk about complex structures like tries or segment trees.",2
I won't understand the advanced server concepts if I've never configured or studied networking fundamentals previously.,2
"A strong knowledge of calculus is required, as there's no plan to reintroduce integral and differential concepts in this course.",2
"We won't re-teach statistics from scratch, so I'd be completely left behind if I haven't learned it thoroughly already.",2
"I absolutely need prior Docker knowledge, because the labs won't slow down for novices at all.",2
"Discrete math is at the core of everything here, so not having it fully mastered means I can't keep up with the proofs and logic.",2
"If I haven't developed an understanding of Git branching workflows, I'd disrupt the project collaboration, making it impossible to proceed.",2
"I must have used Java intensively before, otherwise I'd fail to implement the advanced patterns expected in the assignments.",2
"Unless I'm solid on probability theory, I'd miss every key concept in the data modeling portion, making it mandatory for me.",2
"There's no chance I'd follow object-oriented design patterns if I've never done them, so it's an essential requirement.",2
"I must arrive with web dev basics locked down, because the course won't dwell on simple HTML or CSS at all.",2
"Not having advanced calculus will doom me in the optimization sections, so I'd better have that knowledge beforehand.",2
"My success depends on prior exposure to advanced algorithms, or I'd never grasp the complexities in time.",2
"Advanced data structures are fundamental here, so if I'm missing them, I'd be unable to pass the more difficult tasks.",2
"Without thorough knowledge of machine learning frameworks, I'd be lost at step one, so it's absolutely imperative for me.",2
"I can't proceed unless I've coded in Python extensively, because we jump straight into complex examples without teaching syntax.",2
"If I haven't studied discrete logic and proofs, I'd misunderstand the entire foundation of the combinatorial topics covered.",2
"I must already be proficient in statistics, or I'd never interpret the advanced data sets and significance testing properly.",2
"I'm required to have an OOP background in C++ or Java, or I'd be confused by the design patterns from the start.",2
"Full knowledge of data structures—beyond arrays and lists—is mandatory, or I'd fail in the complex coding challenges ahead.",2
"I can't keep up if I've never touched version control before, so that's an absolute prerequisite for me.",2
"If I'm lacking experience in front-end frameworks, I'd be stuck the second we delve into advanced React or Angular topics.",2
"Prior Docker Compose usage is a hard requirement, as the labs won't slow down to teach container composition from scratch.",2
"I need advanced discrete math to handle the complexity of the proofs assigned, so there's no wiggle room on that requirement.",2
"Data analysis with Python is already expected knowledge, or I'd be behind the rest of the class from day one.",2
"If I haven't studied concurrency in detail, I'd be unable to debug multi-threaded processes, so it's mandatory training before this.",2
"I must be comfortable with mathematical proofs, as we won't stop to teach basic proof methods or logic structures again.",2
"A thorough grounding in algorithms is essential, or I'd never complete the advanced coding tasks on time.",2
"If I don't know Git at an intermediate level, I'd break the workflow for group assignments, so it must be in place beforehand.",2
"I must be well-versed in object-oriented design from prior courses, or I'd have no clue how to structure these large projects.",2
"I require an advanced understanding of data modeling, or I'd fail to handle the complex queries we'll practice in the course.",2
"No part of the advanced machine learning track is feasible if I haven't taken a fundamental ML course earlier, so it's a must.",2
"I'm obligated to have a background in front-end basics, or I'd hamper the entire team's progress when building the UI sections.",2
"Because we skip basic calculus, I need that knowledge going in, or I'd be lost in the partial derivative methods used here.",2
"I can't engage with the advanced data structure labs if I'm not already comfortable with BFS, DFS, and graph representations.",2
"Unless I've thoroughly learned database design, I'd misunderstand the normalization labs and thus fail them outright.",2
"Knowledge of advanced math is required, or I'd never follow the numerical optimization approach used in these lessons.",2
"I absolutely need pre-existing coding skills in Python or R for the data science portion, or I'd drop behind instantly.",2
"Discrete structures are vital to the entire course flow, so there's no way to proceed if I haven't mastered them already.",2
"I must arrive knowing advanced Git commands, or I'd slow down the version control segments significantly.",2
"Object-oriented concepts can't be taught from zero here, so having that knowledge is an ironclad requirement for me.",2
"My only chance is if I'm proficient in statistics, because we won't hold hands explaining mean, variance, or standard deviation anymore.",2
"If I can't handle advanced concurrency theory, I'd fail the portion on parallel tasks, so it's absolutely mandatory.",2
"Web dev fundamentals must be prior knowledge, or I'd never catch up once we start advanced component-based frameworks.",2
"I can't handle containerization labs if I've never touched Docker, meaning I must bring that experience with me into this course.",2
"Without thorough linear algebra, I'd be lost in the matrix-heavy sections, making it a mandatory prerequisite.",2
"Since I'm not going to learn basic calculus here, I'd better already be comfortable with differentiation and integration concepts.",2
